title,url,score,num_comments,created
Sunday Daily Thread: What's everyone working on this week?,https://www.reddit.com/r/Python/comments/1dm9767/sunday_daily_thread_whats_everyone_working_on/,8,9,2024-06-23 00:00:10
Saturday Daily Thread: Resource Request and Sharing! Daily Thread,https://www.reddit.com/r/Python/comments/1dlig0j/saturday_daily_thread_resource_request_and/,6,1,2024-06-22 00:00:12
discover-plugins - track which plugins are installed into your python environment,https://www.reddit.com/r/Python/comments/1dm01o1/discoverplugins_track_which_plugins_are_installed/,13,5,2024-06-22 16:53:30
cool tool made with python,https://www.reddit.com/r/Python/comments/1dmf01w/cool_tool_made_with_python/,1,0,2024-06-23 05:30:43
Is anyone here looking for a developer to contribute to your personal projects? ,https://www.reddit.com/r/Python/comments/1dm4h72/is_anyone_here_looking_for_a_developer_to/,4,28,2024-06-22 20:16:12
I made a little Python quiz for interns and new Python developers at my company,https://www.reddit.com/r/Python/comments/1dkz4gv/i_made_a_little_python_quiz_for_interns_and_new/,365,116,2024-06-21 08:33:31
Running Python in Web Browsers,https://www.reddit.com/r/Python/comments/1dl8stp/running_python_in_web_browsers/,45,10,2024-06-21 16:56:44
A simple website scraper script,https://www.reddit.com/r/Python/comments/1dlfge9/a_simple_website_scraper_script/,12,2,2024-06-21 21:40:46
Open source Python projects with good software design that is worth studying,https://www.reddit.com/r/Python/comments/1dkrfgh/open_source_python_projects_with_good_software/,226,42,2024-06-21 00:52:48
Log Monitoring with Kafka ETL using Python via Docker and Pathway,https://www.reddit.com/r/Python/comments/1dl7c60/log_monitoring_with_kafka_etl_using_python_via/,7,1,2024-06-21 15:54:42
localslackirc - bridge slack and IRC,https://www.reddit.com/r/Python/comments/1dl064e/localslackirc_bridge_slack_and_irc/,9,1,2024-06-21 09:48:47
"Python community in Amsterdam, The Netherlands",https://www.reddit.com/r/Python/comments/1dl0f8b/python_community_in_amsterdam_the_netherlands/,7,2,2024-06-21 10:06:05
Eventum: Flexible event generator,https://www.reddit.com/r/Python/comments/1dkvsmy/eventum_flexible_event_generator/,11,2,2024-06-21 04:50:28
Robogram - Minimal Wrapper for Telegram Bot API in Python,https://www.reddit.com/r/Python/comments/1dl4d2r/robogram_minimal_wrapper_for_telegram_bot_api_in/,0,0,2024-06-21 13:44:33
Introducing Lambda Forge: Simplifying AWS Lambda Deployment and Development!,https://www.reddit.com/r/Python/comments/1dlfj8o/introducing_lambda_forge_simplifying_aws_lambda/,0,1,2024-06-21 21:44:19
Robogram - Minimal Wrapper for Telegram Bot API in Python,https://www.reddit.com/r/Python/comments/1dkvoja/robogram_minimal_wrapper_for_telegram_bot_api_in/,1,1,2024-06-21 04:43:34
Friday Daily Thread: r/Python Meta and Free-Talk Fridays,https://www.reddit.com/r/Python/comments/1dkqdsg/friday_daily_thread_rpython_meta_and_freetalk/,0,1,2024-06-21 00:00:42
"Mirascope-Python's Alternative To Langchain
",https://www.reddit.com/r/Python/comments/1dkhmpa/mirascopepythons_alternative_to_langchain/,1,0,2024-06-20 17:40:45
Python on Cloud GPUs,https://www.reddit.com/r/Python/comments/1dketsw/python_on_cloud_gpus/,3,5,2024-06-20 15:44:16
Web scraper for protein prices ,https://www.reddit.com/r/Python/comments/1dkmwzy/web_scraper_for_protein_prices/,0,7,2024-06-20 21:23:57
Textual Serve - Serve TUIs in the browser,https://www.reddit.com/r/Python/comments/1djk6u8/textual_serve_serve_tuis_in_the_browser/,86,11,2024-06-19 14:13:13
Python on ARM laptops,https://www.reddit.com/r/Python/comments/1djtma4/python_on_arm_laptops/,19,48,2024-06-19 20:47:33
Python Project Management Primer,https://www.reddit.com/r/Python/comments/1djp1gw/python_project_management_primer/,32,6,2024-06-19 17:36:51
Video Quality Ranker,https://www.reddit.com/r/Python/comments/1dk0ru7/video_quality_ranker/,1,3,2024-06-20 02:21:20
A JIT compiler for CPython,https://www.reddit.com/r/Python/comments/1djdy0z/a_jit_compiler_for_cpython/,21,4,2024-06-19 08:13:51
Conway's game of life. can you find an optimization?,https://www.reddit.com/r/Python/comments/1djta0v/conways_game_of_life_can_you_find_an_optimization/,0,6,2024-06-19 20:33:17
json3pdf : Batch OCR for high quality document archiving.,https://www.reddit.com/r/Python/comments/1djlr6e/json3pdf_batch_ocr_for_high_quality_document/,4,0,2024-06-19 15:19:45
"Thursday Daily Thread: Python Careers, Courses, and Furthering Education!",https://www.reddit.com/r/Python/comments/1djxyyw/thursday_daily_thread_python_careers_courses_and/,1,1,2024-06-20 00:00:08
Experimental Python Wheels for Windows on ARM64,https://www.reddit.com/r/Python/comments/1djpj8t/experimental_python_wheels_for_windows_on_arm64/,2,0,2024-06-19 17:57:33
Parsing Python ASTs 20x faster with Rust,https://www.reddit.com/r/Python/comments/1div2e8/parsing_python_asts_20x_faster_with_rust/,37,14,2024-06-18 16:36:18
Trying to find this package,https://www.reddit.com/r/Python/comments/1dj6q3w/trying_to_find_this_package/,5,2,2024-06-19 01:03:39
Wednesday Daily Thread: Beginner questions,https://www.reddit.com/r/Python/comments/1dj5f2u/wednesday_daily_thread_beginner_questions/,3,2,2024-06-19 00:00:08
I am Nominating Myself for PSF Board of Directors,https://www.reddit.com/r/Python/comments/1djunb5/i_am_nominating_myself_for_psf_board_of_directors/,0,9,2024-06-19 21:30:44
Scrapegraph AI Tutorial; Scrape Websites Easily With LLaMA AI,https://www.reddit.com/r/Python/comments/1dip146/scrapegraph_ai_tutorial_scrape_websites_easily/,7,1,2024-06-18 12:05:59
What are the hardware requirements in a laptop to run Python + Future AI based projects?,https://www.reddit.com/r/Python/comments/1djfqwx/what_are_the_hardware_requirements_in_a_laptop_to/,0,20,2024-06-19 10:20:46
Looking for a good WYZIWIG/visual editor to go with with Jinja + Weasyprint,https://www.reddit.com/r/Python/comments/1diqpcb/looking_for_a_good_wyziwigvisual_editor_to_go/,5,2,2024-06-18 13:28:55
NumPy 2.0.0 is the first major release since 2006.,https://www.reddit.com/r/Python/comments/1dhtifv/numpy_200_is_the_first_major_release_since_2006/,571,58,2024-06-17 08:53:18
Load Tests Python Task Queues,https://www.reddit.com/r/Python/comments/1digyfg/load_tests_python_task_queues/,18,2,2024-06-18 03:24:26
 Aurora: An extensible Python static site generator ,https://www.reddit.com/r/Python/comments/1di1v8c/aurora_an_extensible_python_static_site_generator/,56,9,2024-06-17 16:09:56
Suggestion: make ray.io a part of Python's std lib,https://www.reddit.com/r/Python/comments/1djdl3q/suggestion_make_rayio_a_part_of_pythons_std_lib/,0,13,2024-06-19 07:48:43
Advise on choosing UI technology with Python,https://www.reddit.com/r/Python/comments/1dhyr23/advise_on_choosing_ui_technology_with_python/,21,18,2024-06-17 13:58:51
Tuesday Daily Thread: Advanced questions,https://www.reddit.com/r/Python/comments/1dicxw6/tuesday_daily_thread_advanced_questions/,2,0,2024-06-18 00:00:08
Ruff: A Modern Python Linter for Error-Free and Maintainable Code,https://www.reddit.com/r/Python/comments/1disz53/ruff_a_modern_python_linter_for_errorfree_and/,0,27,2024-06-18 15:08:21
Advice for creating 3D modelling program,https://www.reddit.com/r/Python/comments/1dhudt2/advice_for_creating_3d_modelling_program/,4,10,2024-06-17 09:57:08
pieshell: python for shell scripting and as an interactive shell,https://www.reddit.com/r/Python/comments/1dhhohd/pieshell_python_for_shell_scripting_and_as_an/,22,15,2024-06-16 21:21:46
 PyPI Scout - Searching for Python packages on PyPI using vector embeddings ,https://www.reddit.com/r/Python/comments/1dhylia/pypi_scout_searching_for_python_packages_on_pypi/,1,1,2024-06-17 13:52:04
How does Python earn money? What would have been their business model?,https://www.reddit.com/r/Python/comments/1dimpim/how_does_python_earn_money_what_would_have_been/,0,29,2024-06-18 09:44:19
 I created a script to automatically patch revanced,https://www.reddit.com/r/Python/comments/1dhfnl6/i_created_a_script_to_automatically_patch_revanced/,15,4,2024-06-16 19:49:24
Monday Daily Thread: Project ideas!,https://www.reddit.com/r/Python/comments/1dhkxbq/monday_daily_thread_project_ideas/,7,0,2024-06-17 00:00:09
abstract-factories - a simple framework for content creation pipelines,https://www.reddit.com/r/Python/comments/1dhcdre/abstractfactories_a_simple_framework_for_content/,12,5,2024-06-16 17:18:16
"Showcase: pdf-to-podcast.com -- Convert PDF's to podcast episodes. Free and open-source :)
",https://www.reddit.com/r/Python/comments/1dhii88/showcase_pdftopodcastcom_convert_pdfs_to_podcast/,3,1,2024-06-16 22:00:34
Have anyone tried google/mesop,https://www.reddit.com/r/Python/comments/1dh1uu1/have_anyone_tried_googlemesop/,43,12,2024-06-16 06:55:10
I created Yu-Gi-Oh! Power of Chaos save handler,https://www.reddit.com/r/Python/comments/1dh62bk/i_created_yugioh_power_of_chaos_save_handler/,6,0,2024-06-16 12:00:34
Tutorial: A Timely Python Multi-page Streamlit Application on Olympic Medal Winning Countries,https://www.reddit.com/r/Python/comments/1dh2o89/tutorial_a_timely_python_multipage_streamlit/,10,1,2024-06-16 07:55:16
Learning Python coming from a JVM background ,https://www.reddit.com/r/Python/comments/1dgye28/learning_python_coming_from_a_jvm_background/,18,27,2024-06-16 03:09:23
I made a cool calendar app with PyQt6,https://www.reddit.com/r/Python/comments/1dgpg4g/i_made_a_cool_calendar_app_with_pyqt6/,50,17,2024-06-15 19:22:30
Better-OrderedMultiDict - a fast pure-pyton implementation of an ordered multi-valued dictionary.,https://www.reddit.com/r/Python/comments/1dgmtbx/betterorderedmultidict_a_fast_purepyton/,38,2,2024-06-15 17:18:56
"Cant decide between flask, django ninja or fastAPI for sideproject",https://www.reddit.com/r/Python/comments/1dgbq1e/cant_decide_between_flask_django_ninja_or_fastapi/,104,132,2024-06-15 06:31:57
Sunday Daily Thread: What's everyone working on this week?,https://www.reddit.com/r/Python/comments/1dgv2s3/sunday_daily_thread_whats_everyone_working_on/,4,15,2024-06-16 00:00:09
Built a RAG ( Retrieval-Augmented Generation ) model using Gemini Api.,https://www.reddit.com/r/Python/comments/1dh3jtj/built_a_rag_retrievalaugmented_generation_model/,0,4,2024-06-16 09:01:59
What if we had a standard for relocating standardized configuration files?,https://www.reddit.com/r/Python/comments/1dgrjsx/what_if_we_had_a_standard_for_relocating/,1,1,2024-06-15 21:02:38
Python automation ideas,https://www.reddit.com/r/Python/comments/1dg4cof/python_automation_ideas/,52,41,2024-06-14 23:27:36
Lua-style code blocks for Python,https://www.reddit.com/r/Python/comments/1dh6v9i/luastyle_code_blocks_for_python/,0,29,2024-06-16 12:48:27
I made an MMORPG with Python & Telegram in 4 weeks,https://www.reddit.com/r/Python/comments/1dftgrl/i_made_an_mmorpg_with_python_telegram_in_4_weeks/,83,39,2024-06-14 15:24:23
Introducing Temporal Adjusters: Simplify Time Series Adjustments in Python!,https://www.reddit.com/r/Python/comments/1dg4fkv/introducing_temporal_adjusters_simplify_time/,9,9,2024-06-14 23:31:28
Created an Api for APKpure,https://www.reddit.com/r/Python/comments/1dg2crg/created_an_api_for_apkpure/,12,3,2024-06-14 21:53:36
Making the most out of Python for specific data analysis tasks...,https://www.reddit.com/r/Python/comments/1dgentt/making_the_most_out_of_python_for_specific_data/,1,1,2024-06-15 10:04:00
Saturday Daily Thread: Resource Request and Sharing! Daily Thread,https://www.reddit.com/r/Python/comments/1dg4zxe/saturday_daily_thread_resource_request_and/,2,1,2024-06-15 00:00:13
"My first Python package, D1py: A very simple library to interact with Cloudflare D1 Database API ",https://www.reddit.com/r/Python/comments/1dft2qf/my_first_python_package_d1py_a_very_simple/,12,3,2024-06-14 15:07:54
"Perpetual - a self-generalizing, hyperparameter-free gradient boosting machine",https://www.reddit.com/r/Python/comments/1dfrpzk/perpetual_a_selfgeneralizing_hyperparameterfree/,10,8,2024-06-14 14:08:28
Problem details for FastAPI applications (RFC9457),https://www.reddit.com/r/Python/comments/1dftrbu/problem_details_for_fastapi_applications_rfc9457/,4,6,2024-06-14 15:36:44
I tried to explain python imports,https://www.reddit.com/r/Python/comments/1dfzuyr/i_tried_to_explain_python_imports/,1,4,2024-06-14 20:02:51
a new version of ultimateultimateguitar,https://www.reddit.com/r/Python/comments/1df7w7f/a_new_version_of_ultimateultimateguitar/,38,7,2024-06-13 19:48:06
how about one-line try-except statement ?,https://www.reddit.com/r/Python/comments/1dfsjdu/how_about_oneline_tryexcept_statement/,0,6,2024-06-14 14:44:52
uv added experimental commands for `uv add/remove`,https://www.reddit.com/r/Python/comments/1desxf4/uv_added_experimental_commands_for_uv_addremove/,136,36,2024-06-13 07:09:33
"Pathway - Build Mission Critical ETL and RAG in Python (used by NATO, F1)",https://www.reddit.com/r/Python/comments/1dezxa3/pathway_build_mission_critical_etl_and_rag_in/,36,15,2024-06-13 14:09:55
Friday Daily Thread: r/Python Meta and Free-Talk Fridays,https://www.reddit.com/r/Python/comments/1dfdinp/friday_daily_thread_rpython_meta_and_freetalk/,1,0,2024-06-14 00:00:50
"Polars 1.0 will be out in a few weeks, but you can already install the pre-release!",https://www.reddit.com/r/Python/comments/1decdu5/polars_10_will_be_out_in_a_few_weeks_but_you_can/,199,58,2024-06-12 17:31:34
Try PyCharm (30% off!) and they donate 100% to the Django Software Foundation,https://www.reddit.com/r/Python/comments/1delqyn/try_pycharm_30_off_and_they_donate_100_to_the/,37,4,2024-06-13 00:13:58
"I ported Rust's Regex Library To Python, but the time taken by the compile parameter was high.",https://www.reddit.com/r/Python/comments/1dfl5ja/i_ported_rusts_regex_library_to_python_but_the/,0,23,2024-06-14 07:27:10
Vedo or PyVista?,https://www.reddit.com/r/Python/comments/1df1546/vedo_or_pyvista/,1,1,2024-06-13 15:02:55
Sold my Python open source project to a San Francisco AI company. Now I work for them. AMA.,https://www.reddit.com/r/Python/comments/1de2llp/sold_my_python_open_source_project_to_a_san/,180,39,2024-06-12 09:37:11
Building AI Text-to-Video Model From Scratch,https://www.reddit.com/r/Python/comments/1dez1ru/building_ai_texttovideo_model_from_scratch/,3,1,2024-06-13 13:30:15
My Thoughts on Python in Excel,https://www.reddit.com/r/Python/comments/1de2hkw/my_thoughts_on_python_in_excel/,91,24,2024-06-12 09:29:13
"Thursday Daily Thread: Python Careers, Courses, and Furthering Education!",https://www.reddit.com/r/Python/comments/1delgo1/thursday_daily_thread_python_careers_courses_and/,1,0,2024-06-13 00:00:09
Kwargs appreciation thread,https://www.reddit.com/r/Python/comments/1ddnokn/kwargs_appreciation_thread/,146,38,2024-06-11 20:05:24
Open-source AI shorts generator in python,https://www.reddit.com/r/Python/comments/1de8hji/opensource_ai_shorts_generator_in_python/,4,3,2024-06-12 14:48:30
 Made a Minimalistic Router for Uvicorn ,https://www.reddit.com/r/Python/comments/1ddqqab/made_a_minimalistic_router_for_uvicorn/,12,7,2024-06-11 22:12:59
Wednesday Daily Thread: Beginner questions,https://www.reddit.com/r/Python/comments/1ddt1vh/wednesday_daily_thread_beginner_questions/,7,4,2024-06-12 00:00:07
A super easy-to-use API monitoring & analytics tool,https://www.reddit.com/r/Python/comments/1ddc8lq/a_super_easytouse_api_monitoring_analytics_tool/,22,4,2024-06-11 11:52:32
TIL that selenium has opt out telemetry. what other common packages do this / similar experiences?,https://www.reddit.com/r/Python/comments/1dcuv0y/til_that_selenium_has_opt_out_telemetry_what/,269,50,2024-06-10 19:55:48
Textchat: TUI Single Server IRC Client,https://www.reddit.com/r/Python/comments/1ddnhs7/textchat_tui_single_server_irc_client/,3,2,2024-06-11 19:57:59
Python Open-CV Tool-Chip Contact Length Calculation,https://www.reddit.com/r/Python/comments/1ddcyun/python_opencv_toolchip_contact_length_calculation/,7,0,2024-06-11 12:32:34
ChatGPT hallucinated a plugin called pytest-edit. So I created it.,https://www.reddit.com/r/Python/comments/1dchk4g/chatgpt_hallucinated_a_plugin_called_pytestedit/,545,61,2024-06-10 09:38:49
Why would anyone use pyqt if pyside exists,https://www.reddit.com/r/Python/comments/1dcedjb/why_would_anyone_use_pyqt_if_pyside_exists/,47,29,2024-06-10 05:49:19
Building an HTTP Server in Python,https://www.reddit.com/r/Python/comments/1dd6tud/building_an_http_server_in_python/,0,9,2024-06-11 05:45:03
Tuesday Daily Thread: Advanced questions,https://www.reddit.com/r/Python/comments/1dd0jsu/tuesday_daily_thread_advanced_questions/,1,1,2024-06-11 00:00:10
open source CLI tool for finding out how programs work,https://www.reddit.com/r/Python/comments/1dcqw42/open_source_cli_tool_for_finding_out_how_programs/,2,4,2024-06-10 17:15:55
Kivy School - Crowdfunding Update,https://www.reddit.com/r/Python/comments/1dcky9z/kivy_school_crowdfunding_update/,0,0,2024-06-10 13:01:38
Async Python Clarifications,https://www.reddit.com/r/Python/comments/1dbxkd6/async_python_clarifications/,36,16,2024-06-09 16:20:24
